{
  "schemaVersion": 1,
  "kind": "refs",
  "objectFormat": "sha1",
  "baseCommit": "1111111111111111111111111111111111111111",
  "headCommit": "2222222222222222222222222222222222222222",
  "baseTree": "3333333333333333333333333333333333333333",
  "headTree": "4444444444444444444444444444444444444444",
  "diffSha256": "5555555555555555555555555555555555555555555555555555555555555555",
  "headContentHash": "6666666666666666666666666666666666666666666666666666666666666666"
}
